{
  "format": 1,
  "plugin": "lighthouse",
  "purpose": "lighthouse proves a FEATURE branch works before it merges into its core branch, by running the project's suite on both branches, driving the running product, rechecking the surfaces next to the change and computing a verdict.",
  "objectives": [
    {
      "id": "verdict",
      "text": "Every run ends in a computed verdict.",
      "measured_by": [
        "summary.verdict",
        "summary.reason",
        "summary.failures",
        "summary.unproven",
        "summary.flaky"
      ]
    },
    {
      "id": "suite",
      "text": "The project's suite runs on both branches.",
      "measured_by": [
        "summary.suite",
        "summary.build"
      ]
    },
    {
      "id": "new-behaviour",
      "text": "Each new behaviour is driven.",
      "measured_by": [
        "summary.paths"
      ]
    },
    {
      "id": "neighbours",
      "text": "Each neighbour is rechecked on both builds.",
      "measured_by": [
        "summary.paths"
      ]
    },
    {
      "id": "cost",
      "text": "What a run costs in time and money.",
      "measured_by": [
        "summary.run_seconds",
        "summary.usd",
        "summary.tokens",
        "summary.models",
        "summary.steps",
        "summary.drives",
        "summary.caller",
        "summary.waiting",
        "summary.expired_rewrites"
      ]
    }
  ],
  "events": {
    "run.start": {
      "description": "lighthouse launch began a run, written before it starts the child session.",
      "writer": "lighthouse launch",
      "readers": [
        "owner",
        "a harness reading its child runs"
      ],
      "questions": [
        "When did the run start, and which run of a harness started it?",
        "Which branches and options was the run given?",
        "Which launches never finished?"
      ],
      "fields": {
        "core": {
          "type": "string",
          "description": "The core branch the run compares against.",
          "measured_from": "The --core flag lighthouse launch was given.",
          "unit": "id",
          "includes": "The branch name as given.",
          "excludes": "The commit, which the summary's core_commit records.",
          "reading": "A name identifies the branch; null means unknown.",
          "readers": [
            "owner"
          ],
          "question": "Which core branch was the run proving against?"
        },
        "feature": {
          "type": "string",
          "description": "The FEATURE branch the run proves.",
          "measured_from": "The --feature flag lighthouse launch was given.",
          "unit": "id",
          "includes": "The branch name as given.",
          "excludes": "The commit, which the summary's feature_commit records.",
          "reading": "A name identifies the branch; null means unknown.",
          "readers": [
            "owner"
          ],
          "question": "Which FEATURE branch was the run proving?"
        },
        "results": {
          "type": "string",
          "description": "The results folder's absolute path.",
          "measured_from": "The --results flag lighthouse launch was given, resolved.",
          "unit": "text",
          "includes": "The folder the child session works and writes in.",
          "excludes": "The repository, which repo records.",
          "reading": "A path names the folder; null means unknown.",
          "readers": [
            "owner"
          ],
          "question": "Where are the run's working files?"
        },
        "retest": {
          "type": "boolean",
          "description": "Whether the run retests from previous results.",
          "measured_from": "Whether lighthouse launch was given --previous.",
          "unit": "none",
          "includes": "Runs given a previous results folder.",
          "excludes": "Runs that start fresh.",
          "reading": "true means a retest; false means a fresh run; null means unknown.",
          "readers": [
            "owner"
          ],
          "question": "How often does a run retest from earlier results?"
        },
        "final": {
          "type": "boolean",
          "description": "Whether the run was the final one before opening the pull request.",
          "measured_from": "Whether lighthouse launch was given --final.",
          "unit": "none",
          "includes": "Runs given --final.",
          "excludes": "Runs without --final.",
          "reading": "true means the run was final; false means it was not; null means unknown.",
          "readers": [
            "owner"
          ],
          "question": "How often is a run the final one?"
        },
        "spec": {
          "type": "boolean",
          "description": "Whether the run was given a spec to read.",
          "measured_from": "Whether lighthouse launch was given --spec.",
          "unit": "none",
          "includes": "Runs given a spec.",
          "excludes": "Runs without a spec.",
          "reading": "true means a spec was given; false means none was; null means unknown.",
          "readers": [
            "owner"
          ],
          "question": "How often does a run have a spec?"
        }
      }
    },
    "run.end": {
      "description": "The run's child session ended, written by lighthouse launch before the summary.",
      "writer": "lighthouse launch",
      "readers": [
        "owner",
        "a harness reading its child runs"
      ],
      "questions": [
        "How did the run end and how long did it take?",
        "Which caller messages fall inside the run's span?"
      ],
      "fields": {
        "verdict": {
          "type": "enum",
          "description": "The run's computed verdict.",
          "measured_from": "The verdict line lighthouse launch prints: the child's last verdict line, or launch's own blocked line.",
          "unit": "none",
          "includes": "One of green, failures, blocked or unproven.",
          "excludes": "Any opinion beyond the computed verdict.",
          "reading": "green means proven with no failure; failures means at least one confirmed failure; blocked means the run stopped; unproven means the new behaviour was not shown; null means unknown.",
          "readers": [
            "owner",
            "a harness reading its child runs"
          ],
          "question": "How do runs end?",
          "values": [
            "green",
            "failures",
            "blocked",
            "unproven"
          ]
        },
        "child_exit": {
          "type": "integer",
          "description": "The child session's exit code.",
          "measured_from": "The exit status of the claude -p child session lighthouse launch started.",
          "unit": "none",
          "includes": "The code the child process returned.",
          "excludes": "lighthouse launch's own exit code.",
          "reading": "0 means the child exited normally; any other value is the code it gave; null means the child never started.",
          "readers": [
            "owner"
          ],
          "question": "How often does the child session exit abnormally?"
        },
        "run_seconds": {
          "type": "number",
          "description": "How long the run took from run.start to run.end.",
          "measured_from": "The time of run.end minus the time of run.start, as launch took them.",
          "unit": "seconds",
          "includes": "The whole child session and launch's own work before and after it.",
          "excludes": "The caller's work before launch started and after it ended.",
          "reading": "Higher means longer; 0 means no time was recorded; null means unknown.",
          "readers": [
            "owner",
            "a harness reading its child runs"
          ],
          "question": "How long does a lighthouse run take?"
        }
      }
    }
  },
  "summary": {
    "description": "One line per lighthouse run: its verdict, the suite on both builds, every product path, the build result and lighthouse's own spend, priced at write time. Order runs and state periods by started, never the envelope ts, which for an imported summary is the import's time.",
    "fields": {
      "started": {
        "type": "string",
        "description": "When the run started.",
        "measured_from": "The time lighthouse launch took when it appended run.start.",
        "unit": "timestamp",
        "includes": "A UTC time as YYYY-MM-DDTHH:MM:SSZ.",
        "excludes": "Fractions of a second.",
        "reading": "A later time means later; order runs and state periods by started, never the envelope ts; null means unknown.",
        "readers": [
          "owner",
          "a harness reading its child runs"
        ],
        "question": "When did the run start, and which runs fall in a period?"
      },
      "ended": {
        "type": "string",
        "description": "When the run ended.",
        "measured_from": "The time lighthouse launch took when it appended run.end, after the child session ended.",
        "unit": "timestamp",
        "includes": "A UTC time as YYYY-MM-DDTHH:MM:SSZ.",
        "excludes": "Fractions of a second.",
        "reading": "A later time means later; order runs and state periods by started, never the envelope ts; null means unknown.",
        "readers": [
          "owner",
          "a harness reading its child runs"
        ],
        "question": "When did the run end?"
      },
      "run_seconds": {
        "type": "number",
        "description": "How long the run took from run.start to run.end.",
        "measured_from": "The time of run.end minus the time of run.start, as launch took them.",
        "unit": "seconds",
        "includes": "The whole child session and launch's own work before and after it.",
        "excludes": "The caller's work before launch started and after it ended.",
        "reading": "Higher means longer; 0 means no time was recorded; null means unknown.",
        "readers": [